Soldier of Orange,1977,7.6,"['Drama', 'Romance', 'Thriller', 'War']","Dutch, English, German","Rutger Hauer, Jeroen Krabb, Susan Penhaligon",Paul Verhoeven
Amar Akbar Anthony,1977,7.4,"['Action', 'Comedy', 'Drama', 'Music']",Hindi,"Vinod Khanna, Rishi Kapoor, Amitabh Bachchan",Manmohan Desai
"Messalina, Messalina",1977,4.0,"['Parody', 'Adventure', 'Comedy']",Italian,"Anneka Di Lorenzo, Vittorio Caprioli, Giancarlo Prete",Bruno Corbucci
Beast with a Gun,1977,5.9,"['Action', 'Crime', 'Drama', 'Thriller']",Italian,"Helmut Berger, Marisa Mell, Richard Harrison",Sergio Grieco
Porno Nights of the World,1977,4.0,['Documentary'],"Italian, English","Laura Gemser, Marina Hedman, Fernando Arcangeli","Bruno Mattei, Joe DAmato"
Charleston,1977,5.5,['Comedy'],Italian,"Bud Spencer, Herbert Lom, Jack La Cayenne",Marcello Fondato
Double Nickels,1977,5.0,"['Police Procedural', 'Action', 'Comedy', 'Crime']",English,"Jack Vacek, Trice Schubert, Edward Abrahms",Jack Vacek
The Professionals,1966,7.3,"['Action', 'Adventure', 'Drama', 'Western']","English, Spanish","Burt Lancaster, Lee Marvin, Robert Ryan",Richard Brooks
Duel at Diablo,1966,6.5,"['Classical Western', 'Drama', 'Thriller', 'Western']",English,"James Garner, Sidney Poitier, Bibi Andersson",Ralph Nelson
Return of the Seven,1966,5.5,"['Action', 'Drama', 'Western']","English, Spanish, Greek, Ancient to 1453, Latin","Yul Brynner, Robert Fuller, Julin Mateos",Burt Kennedy
The Ghost in the Invisible Bikini,1966,4.6,"['Comedy', 'Horror', 'Musical']",English,"Tommy Kirk, Deborah Walley, Aron Kincaid",Don Weis
Made in Paris,1966,5.4,"['Romantic Comedy', 'Comedy', 'Romance']","English, French","AnnMargret, Louis Jourdan, Richard Crenna",Boris Sagal
The Daydreamer,1966,6.1,"['Fairy Tale', 'Stop Motion Animation', 'Adventure', 'Animation', 'Drama', 'Family', 'Fantasy', 'Musical']",English,"Tallulah Bankhead, Victor Borge, Patty Duke",Jules Bass
Come imparai ad amare le donne,1966,5.3,['Comedy'],Italian,"Michle Mercier, Nadja Tiller, Elsa Martinelli",Luciano Salce
The Round-Up,1966,7.5,"['Drama', 'History', 'War', 'Western']",Hungarian,"Jnos Grbe, Zoltn Latinovits, Tibor Molnr",Mikls Jancs
War Between the Planets,1966,4.1,['SciFi'],Italian,"Giacomo Rossi Stuart, Ombretta Colli, Enzo Fiermonte",Antonio Margheriti
Secret Agent Super Dragon,1966,2.6,"['Mystery', 'Thriller']",Italian,"Ray Danton, Margaret Lee, Carlo DAngelo",Giorgio Ferroni
As Long as You've Got Your Health,1966,7.1,"['Satire', 'Comedy']",French,"Pierre taix, Denise Pronne, Simone Fonder",Pierre taix
An Eye for an Eye,1966,6.1,['Western'],English,"Robert Lansing, Patrick Wayne, Slim Pickens",Michael D Moore
Abschied von gestern - (Anita G.),1966,6.9,['Drama'],German,"Alexandra Kluge, Gnter Mack, Eva Maria Meineke",Alexander Kluge
O papatrehas,1966,7.9,['Comedy'],Greek,"Thanasis Vengos, Souli Sabah, Iro Kyriakaki",Errikos Thalassinos
Jesse James Meets Frankenstein's Daughter,1966,3.4,"['Horror', 'SciFi', 'Western']","English, German","John Lupton, Narda Onyx, Cal Bolder",William Beaudine
Krybskytterne på Næsbygård,1966,5.5,"['Drama', 'Family']",Danish,"Asbjrn Andersen, Holger Juul Hansen, Inger Stender","Ib Mossin, Alice OFredericks"
Wake Up and Die,1966,6.2,"['Crime', 'Drama']",Italian,"Robert Hoffmann, Lisa Gastoni, Gian Maria Volont",Carlo Lizzani
Der lachende Mann - Bekenntnisse eines Mörders,1966,7.1,"['Documentary', 'War']",German,Siegfried Mller,"Walter Heynowski, Gerhard Scheumann"
Movie Madness,1982,3.2,"['Parody', 'Comedy']",English,"Peter Riegert, Diane Lane, Candy Clark","Bob Giraldi, Henry Jaglom"
Love Strange Love,1982,5.8,['Drama'],Portuguese,"Vera Fischer, Tarcsio Meira, Xuxa",Walter Hugo Khouri
Moj tata na odredjeno vreme,1982,7.1,['Comedy'],SerboCroatian,"Ljubisa Samardzic, Milena Dravic, Boris Dvornik",Milan Jelic
Harry Tracy: The Last of the Wild Bunch,1982,6.1,"['Drama', 'Western']",English,"Bruce Dern, Helen Shaver, Michael C Gwynne",William A Graham
Held,2020,5.3,"['Horror', 'Mystery', 'Thriller']",English,"Jill Awbrey, Bart Johnson, Travis Cluff","Travis Cluff, Chris Lofing"
MLK/FBI,2020,7.0,"['History Documentary', 'Biography', 'Documentary', 'History']",English,"Shaun Bowman, Martin Luther King, J Edgar Hoover",Sam Pollard
Minyan,2020,6.5,['Drama'],"English, Hebrew, Yiddish, Russian","Samuel H Levine, Ron Rifkin, Christopher McCann",Eric Steel
The Old Guard,2020,6.7,"['Globetrotting Adventure', 'Superhero', 'Action', 'Thriller']","English, Arabic, French, Italian","Charlize Theron, KiKi Layne, Matthias Schoenaerts",Gina PrinceBythewood
Run,2020,6.7,"['Psychological Thriller', 'Suspense Mystery', 'Drama', 'Horror', 'Mystery', 'Thriller']",English,"Sarah Paulson, Kiera Allen, Sara Sohn",Aneesh Chaganty
The Very Excellent Mr. Dundee,2020,5.0,['Comedy'],English,"Paul Hogan, Dorothy Adams, Trudy Ager",Dean Murphy
Palm Swings,2020,4.4,"['Comedy', 'Drama', 'Romance']",English,"Tia Carrere, Diane Farr, Jason Lewis",Sean Hoessli
#Alive,2020,6.3,"['Zombie Horror', 'Action', 'Drama', 'Horror', 'Thriller']",Korean,"Yoo Ahin, Park Shinhye, Jeon Baesoo","Il Cho, Jo Il Hyung"
Butchers,2020,4.6,"['Slasher Horror', 'Horror', 'Thriller']",English,"Simon Phillips, Michael Swatton, Julie Mainville",Adrian Langley
The Sleepover,2020,5.7,"['Action', 'Adventure', 'Comedy', 'Family']",English,"Sadie Stanley, Maxwell Simkins, Cree",Trish Sie
A Whisker Away,2020,6.7,"['Anime', 'Adventure', 'Animation', 'Drama', 'Family', 'Fantasy', 'Romance']",Japanese,"Mirai Shida, Natsuki Hanae, Minako Kotobuki","Junichi Sat, Tomotaka Shibayama"
Original Gangster,2020,5.0,['Crime'],English,"Steve Guttenberg, Ian Reddington, Vas Blackwood",Savvas D Michael
Christmas with a Crown,2020,5.4,"['Holiday Romance', 'Holiday', 'Romance']",English,"Lisa Durupt, Marcus Rosner, Teryl Rothery",Dylan Pearce
Love Sarah,2020,6.2,"['Comedy', 'Drama', 'Romance']",English,"Celia Imrie, Shannon Tarbet, Shelley Conn",Eliza Schroeder
Sky High,2020,5.6,['Thriller'],Spanish,"Miguel Herrn, Carolina Yuste, Asia Ortega",Daniel Calparsoro
13 Slays Till X-Mas,2020,4.1,['Horror'],English,"Jeffrey Reddick, Sadie Katz, Jessica Anderson","Brittany Blanton, Sean Blevins, Jed Brian"
Abraham Lincoln: Vampire Hunter,2012,5.9,"['Dark Fantasy', 'Vampire Horror', 'Action', 'Fantasy', 'Horror']",English,"Benjamin Walker, Rufus Sewell, Dominic Cooper",Timur Bekmambetov
The Impossible,2012,7.5,"['Disaster', 'Tragedy', 'Drama', 'History', 'Thriller']","English, Thai, German, Swedish, Spanish","Naomi Watts, Ewan McGregor, Tom Holland",JA Bayona
Man on a Ledge,2012,6.6,"['Dark Comedy', 'Action', 'Crime', 'Thriller']","English, Spanish","Sam Worthington, Elizabeth Banks, Jamie Bell",Asger Leth
Evangelion: 3.0 You Can (Not) Redo,2012,6.9,"['Adult Animation', 'Anime', 'Mecha', 'Action', 'Animation', 'Drama', 'SciFi']","English, German, Spanish, French, Catalan, Russian, Italian, Korean, Thai, Cantonese, Japanese","Megumi Ogata, Megumi Hayashibara, Yko Miyamura","Mahiro Maeda, Masayuki, Kazuya Tsurumaki"
Our Children,2012,6.8,"['Crime', 'Drama']","French, Arabic","milie Dequenne, Claire Bodson, Niels Arestrup",Joachim Lafosse
Star Wars: Episode VIII - The Last Jedi,2017,6.9,"['Action Epic', 'Adventure Epic', 'Fantasy Epic', 'SciFi Epic', 'Space SciFi', 'Action', 'Adventure', 'Fantasy', 'SciFi']",English,"Daisy Ridley, John Boyega, Mark Hamill",Rian Johnson
Kingsman: The Golden Circle,2017,6.7,"['Drug Crime', 'Satire', 'Action', 'Adventure', 'Comedy', 'Crime', 'Thriller']","English, Italian, Swedish","Taron Egerton, Colin Firth, Mark Strong",Matthew Vaughn
Captain Underpants: The First Epic Movie,2017,6.2,"['Buddy Comedy', 'Computer Animation', 'Farce', 'HighConcept Comedy', 'Parody', 'Slapstick', 'Superhero', 'Urban Adventure', 'Action', 'Adventure']","English, German","Kevin Hart, Thomas Middleditch, Ed Helms",David Soren
Happy Death Day,2017,6.6,"['Dark Comedy', 'Slasher Horror', 'Teen Horror', 'Comedy', 'Horror', 'Mystery', 'Thriller']","English, Spanish","Jessica Rothe, Israel Broussard, Ruby Modine",Christopher Landon
The Circle,2017,5.4,"['Conspiracy Thriller', 'Cyber Thriller', 'Drama', 'Mystery', 'SciFi', 'Thriller']",English,"Emma Watson, Tom Hanks, John Boyega",James Ponsoldt
Phoenix Forgotten,2017,5.4,"['Found Footage Horror', 'Horror', 'Mystery', 'SciFi', 'Thriller']",English,"Florence Hartigan, Luke Spencer Roberts, Chelsea Lopez",Justin Barber
The Rider,2017,7.4,"['Drama', 'Western']","English, Sioux, Spanish","Brady Jandreau, Mooney, Tim Jandreau",Chlo Zhao
Pokémon the Movie: I Choose You!,2017,6.3,"['Anime', 'Action', 'Adventure', 'Animation', 'Comedy', 'Drama', 'Family', 'Fantasy', 'SciFi']","Japanese, English","Unsh Ishizuka, Rica Matsumoto, Sarah Natochenny",Kunihiko Yuyama
Jane,2017,7.8,"['Science  Technology Documentary', 'Biography', 'Documentary']",English,"Jane Goodall, Hugo Van Lawick, Hugo Eric Louis van Lawick",Brett Morgen
3 Idiots,2017,4.4,['Comedy'],Spanish,"Martha Higareda, Alfonso Dosal, Christian Vazquez","Rajkumar Hirani, Sham Kaushal, Shantanu Moitra"
Thelma,2017,6.9,"['Drama', 'Fantasy', 'Horror', 'Mystery', 'Romance', 'SciFi', 'Thriller']","Norwegian, Swedish, English","Eili Harboe, Kaya Wilkins, Henrik Rafaelsen",Joachim Trier
Saving Brinton,2017,7.5,['Documentary'],English,"Michael Zahs, Serge Bromberg, Greg Prickman","Tommy Haines, Andrew Sherburne"
Beautiful Accident,2017,6.5,"['Comedy', 'Fantasy']",Mandarin,"LunMei Gwei, Jingchun Wang, NaNa OuYang",Wi Ding Ho
The China Hustle,2017,7.1,['Documentary'],"English, Mandarin","Dan David, Matthew Wiechert, Herb Greenberg",Jed Rothstein
Pirates of the Caribbean: On Stranger Tides,2011,6.6,"['Fantasy Epic', 'Quest', 'Sea Adventure', 'Swashbuckler', 'Action', 'Adventure', 'Fantasy']","English, Spanish","Johnny Depp, Penlope Cruz, Ian McShane",Rob Marshall
Captain America: The First Avenger,2011,6.9,"['SciFi Epic', 'Superhero', 'Action', 'Adventure', 'SciFi']","English, Norwegian, French","Chris Evans, Hugo Weaving, Samuel L Jackson",Joe Johnston
The Rum Diary,2011,6.1,"['Comedy', 'Drama']","English, Spanish, German","Johnny Depp, Giovanni Ribisi, Aaron Eckhart",Bruce Robinson
Take Shelter,2011,7.3,"['Psychological Drama', 'Psychological Thriller', 'Workplace Drama', 'Drama', 'Thriller']",English,"Michael Shannon, Jessica Chastain, Shea Whigham",Jeff Nichols
Rampart,2011,5.8,"['Crime', 'Drama']",English,"Woody Harrelson, Ben Foster, Sigourney Weaver",Oren Moverman
Pariah,2011,7.2,"['ComingofAge', 'Teen Drama', 'Drama']",English,"Adepero Oduye, Kim Wayans, Aasha Davis",Dee Rees
The Last Lions,2011,8.2,"['Nature Documentary', 'Documentary', 'Family']",English,Jeremy Irons,Dereck Joubert
Undefeated,2011,7.7,"['Football', 'Sports Documentary', 'Documentary', 'Sport']",English,"Bill Courtney, OC Brown, Montrail Money Brown","Daniel Lindsay, TJ Martin"
Creature,2011,3.6,['Horror'],English,"Mehcad Brooks, Serinda Swan, Daniel Bernhardt",Fred Andrews
CornerStore,2011,7.2,['Comedy'],English,"Lawrence Lamont, Roger Guenveur Smith, Ari Rufino",Joseph Doughrity
The Swimming Pool,1969,7.1,"['Psychological Drama', 'Crime', 'Drama', 'Romance']","French, English","Alain Delon, Romy Schneider, Maurice Ronet",Jacques Deray
"Hook, Line and Sinker",1969,5.4,['Comedy'],"English, Spanish, Portuguese","Jerry Lewis, Peter Lawford, Anne Francis",George Marshall
Double Suicide,1969,7.6,"['Drama', 'Romance']",Japanese,"Kichiemon Nakamura, Shima Iwashita, Shizue Kawarazaki",Masahiro Shinoda
Snegurochka,1969,6.9,"['Family', 'Fantasy', 'Musical', 'Romance']",Russian,"Eugenia Filonova, Evgeniy Zharikov, Irina Gubanova",Pavel Kadochnikov
Van de Velde: Das Leben zu zweit - Sexualität in der Ehe,1969,4.1,['Romance'],German,"KarlHeinz Bauer, Barbara Scott, Hans Hass Jr",Franz Josef Gottlieb
Angel,1983,5.8,"['Action', 'Crime', 'Thriller']",English,"Cliff Gorman, Susan Tyrrell, Dick Shawn",Robert Vincent ONeil
Gabriela,1983,6.2,"['Comedy', 'Drama', 'Romance']",Portuguese,"Sonia Braga, Marcello Mastroianni, Antonio Cantafora",Bruno Barreto
El Sur,1983,7.8,"['ComingofAge', 'Tragic Romance', 'Drama', 'Mystery', 'Romance']",Spanish,"Omero Antonutti, Sonsoles Aranguren, Icar Bollan",Vctor Erice
Eyes of Fire,1983,6.2,"['Folk Horror', 'Drama', 'Horror', 'Western']",English,"Dennis Lipscomb, Guy Boyd, Rebecca Stanley",Avery Crounse
Spring Symphony,1983,6.1,"['Biography', 'Music']",German,"Nastassja Kinski, Herbert Grnemeyer, Rolf Hoppe",Peter Schamoni
Thoongathey Tambi Thoongathey,1983,6.5,['Drama'],Tamil,"Kamal Haasan, Radha, Goundamani",SP Muthuraman
Kirot,1983,4.0,"['Drama', 'Romance']","Filipino, English, Tagalog","Stella Strada, Dennis Roldan, Edgar Mande",Arsenio Bautista
Cannonball Run II,1984,5.1,"['Car Action', 'Road Trip', 'Action', 'Comedy']",English,"Burt Reynolds, Dom DeLuise, Dean Martin","Hal Needham, Ralph Bakshi"
The NeverEnding Story,1984,7.3,"['Adventure Epic', 'Fantasy Epic', 'Quest', 'Sword  Sorcery', 'Adventure', 'Drama', 'Family', 'Fantasy']",English,"Noah Hathaway, Barret Oliver, Tami Stronach",Wolfgang Petersen
Breakin' 2: Electric Boogaloo,1984,5.2,"['Pop Musical', 'Comedy', 'Drama', 'Musical']","English, Spanish","Lucinda Dickey, Adolfo Quinones, Michael Chambers",Sam Firstenberg
Birdy,1984,7.2,"['Drama', 'War']",English,"Matthew Modine, Nicolas Cage, John Harkins",Alan Parker
Petit Con,1984,6.0,['Comedy'],French,"Guy Marchand, Caroline Cellier, Bernard Brieux",Grard Lauzier
Winter Flight,1984,7.3,"['Drama', 'Romance']",English,"Reece Dinsdale, Nicola Cowper, Gary Olsen",Roy Battersby
The Dog Who Stopped the War,1984,7.5,"['Comedy', 'Drama', 'Family']",French,"Cdric Jourde, MariePierre A DAmour, Julien Elie",Andr Melanon
Double Trouble,1984,7.1,"['Buddy Comedy', 'Action', 'Comedy']","Italian, English, Portuguese","Terence Hill, Bud Spencer, April Clough",Enzo Barboni
Sword of the Valiant,1984,4.4,"['Swashbuckler', 'Sword  Sorcery', 'Action', 'Adventure', 'Fantasy', 'Romance']",English,"Miles OKeeffe, Cyrielle Clair, Leigh Lawson",Stephen Weeks
Hell Behind the Bars,1984,3.8,"['Action', 'Crime', 'Drama', 'Thriller']","English, Italian","Ajita Wilson, Rita Silva, Linda Jones",Gianni Siragusa
Rats: Night of Terror,1984,4.7,"['BHorror', 'Horror', 'SciFi']",Italian,"Ottaviano DellAcqua, Geretta Geretta, Massimo Vanni","Bruno Mattei, Claudio Fragasso"
Maybe It's Love,1984,5.5,"['Drama', 'Mystery']",Cantonese,"Cherie Chung, Kent Tong, ChunHao Chen",Angela Chan
Elite Devassa,1984,5.0,['Drama'],Portuguese,"Selma Egrei, Edson Frana, Thales Pan Chacon",Luiz Castellini
Pati Patni Aur Woh,2019,5.8,"['Comedy', 'Romance']",Hindi,"Kartik Aaryan, Bhumi Pednekar, Ananya Panday",Mudassar Aziz
The Reliant,2019,3.3,['Action'],English,"Kevin Sorbo, Julia Denton, Mollee Gray",Paul Munger
The Informer,2019,6.6,"['Police Procedural', 'Prison Drama', 'Spy', 'Action', 'Crime', 'Drama', 'Thriller']","English, Polish, Spanish","Joel Kinnaman, Rosamund Pike, Common",Andrea Di Stefano
Mister America,2019,6.4,['Comedy'],English,"Tim Heidecker, Gregg Turkington, Terri Parks",Eric Notarnicola
Intuitions,2019,3.7,"['Romance', 'Thriller']","English, Spanish","Ren Mena, Mike Manning, Vannessa Vasquez",James Helsing
Kill Bill: Vol. 2,2004,8.0,"['Kung Fu', 'Martial Arts', 'OnePerson Army Action', 'Action', 'Crime', 'Thriller']","English, Cantonese, Mandarin, Spanish","Uma Thurman, David Carradine, Michael Madsen",Quentin Tarantino
Kung Fu Hustle,2004,7.7,"['Kung Fu', 'Martial Arts', 'Parody', 'Slapstick', 'Wuxia', 'Action', 'Comedy', 'Fantasy']","Mandarin, Cantonese","Stephen Chow, Wah Yuen, Qiu Yuen",Stephen Chow
Envy,2004,4.8,"['Buddy Comedy', 'Dark Comedy', 'Comedy']","English, Italian","Ben Stiller, Jack Black, Rachel Weisz",Barry Levinson
Touch of Pink,2004,6.4,"['Comedy', 'Drama', 'Romance']",English,"Jimi Mistry, Kris HoldenRied, Suleka Mathew",Ian Iqbal Rashid
Kings & Queen,2004,7.0,"['Comedy', 'Drama', 'Romance']","French, English, German","Emmanuelle Devos, Geoffrey Carey, Thierry Bosc",Arnaud Desplechin
Rolling Family,2004,6.6,"['Comedy', 'Drama']",Spanish,"Graciana Chironi, Adelina Bielopolsky, Ludmila Stancer",Pablo Trapero
The Ister,2004,7.1,['Documentary'],"French, German, Romanian, English","Philippe LacoueLabarthe, JeanLuc Nancy, Bernard Stiegler","David Barison, Daniel Ross"
Producing Adults,2004,6.1,"['Comedy', 'Drama']",Finnish,"Minna Haapkyl, KariPekka Toivonen, Minttu Mustakallio",Aleksi Salmenper
King's Game,2004,7.3,"['Political Thriller', 'Drama', 'Thriller']",Danish,"Anders W Berthelsen, Sren Pilmark, Nastja Arcel",Nikolaj Arcel
Madame,1961,6.0,"['Comedy', 'Drama', 'Romance', 'War']","French, Italian","Sophia Loren, Robert Hossein, Renaud Mary",ChristianJaque
A Cold Wind in August,1961,6.6,['Drama'],"Italian, English","Lola Albright, Scott Marlowe, Joe De Santis",Alexander Singer
Pagan Island,1961,4.5,"['Action', 'Adventure']",English,"Eddie Dew, Nani Maka, Trine Hovelsrud",Barry Mahon
Queen of the Seas,1961,5.5,"['Action', 'Adventure', 'Drama', 'Romance']",Italian,"Lisa Gastoni, Jerome Courtland, Walter Barnes",Umberto Lenzi
The Canadians,1961,5.4,['Western'],English,"Robert Ryan, John Dehner, Torin Thatcher",Burt Kennedy
Suicídate mi amor,1961,7.0,"['Comedy', 'Drama']",Spanish,"Germn Valds, Tere Velzquez, Marina Camacho",Gilberto Martnez Solares
The Corsican Brothers,1961,5.5,['Action'],"Italian, French","Geoffrey Horne, Valrie Lagrange, Grard Barray",Anton Giulio Majano
I Now Pronounce You Chuck & Larry,2007,5.9,"['Comedy', 'Romance']",English,"Adam Sandler, Kevin James, Jessica Biel",Dennis Dugan
Because I Said So,2007,5.6,"['Romantic Comedy', 'Comedy', 'Romance']","English, Mandarin, Italian","Diane Keaton, Mandy Moore, Gabriel Macht",Michael Lehmann
28 Weeks Later,2007,6.9,"['Zombie Horror', 'Horror', 'SciFi']",English,"Jeremy Renner, Rose Byrne, Robert Carlyle",Juan Carlos Fresnadillo
Daddy Day Camp,2007,3.2,"['Slapstick', 'Comedy', 'Family']",English,"Cuba Gooding Jr, Lochlyn Munro, Richard Gant",Fred Savage
Nobel Son,2007,6.1,"['Caper', 'Dark Comedy', 'Comedy', 'Crime', 'Drama', 'Thriller']",English,"Alan Rickman, Bryan Greenberg, Shawn Hatosy",Randall Miller
My Winnipeg,2007,7.5,"['Dark Comedy', 'Comedy', 'Documentary', 'Drama', 'Fantasy', 'History']",English,"Darcy Fehr, Ann Savage, Louis Negin",Guy Maddin
Cover,2007,5.3,"['Crime', 'Drama', 'Thriller']",English,"Aunjanue EllisTaylor, Razaaq Adoti, Vivica A Fox",Bill Duke
Fear(s) of the Dark,2007,6.6,"['Adult Animation', 'Supernatural Horror', 'Animation', 'Horror', 'Mystery']",French,"Aure Atika, Guillaume Depardieu, Nicole Garcia","Blutch, Charles Burns, Marie Caillou"
Mother of Tears,2007,5.0,"['Supernatural Horror', 'Witch Horror', 'Drama', 'Horror', 'Thriller']","Italian, Japanese, Hungarian, English","Asia Argento, Cristian Solimeno, Adam James",Dario Argento
YPF,2007,6.2,"['Comedy', 'Drama', 'Romance']",English,"Aaron Abrams, Carly Pope, Kristin Booth",Martin Gero
Bronco Billy,1980,6.2,"['Contemporary Western', 'Action', 'Adventure', 'Comedy', 'Drama', 'Romance', 'Western']",English,"Clint Eastwood, Sondra Locke, Geoffrey Lewis",Clint Eastwood
The Gong Show Movie,1980,4.4,"['Dark Comedy', 'Comedy']",English,"Chuck Barris, Robin Altman, Brian OMullin",Chuck Barris
The King and the Mockingbird,1980,7.7,"['Animation', 'Family', 'Fantasy', 'Romance']",French,"Jean Martin, Pascal Mazzotti, Raymond Bussires",Paul Grimault
The Amorous Sisters,1982,4.9,['Comedy'],German,"Brigitte Lahaie, Flore Sollier, Jane Baker",Erwin C Dietrich
Nightkill,1980,5.5,"['Crime', 'Horror', 'Mystery', 'Thriller']",English,"Robert Mitchum, Jaclyn Smith, Mike Connors",Ted Post
Zübük,1980,8.5,['Comedy'],Turkish,"Kemal Sunal, Nevra Serezli, Metin Serezli",Kartal Tibet
Confidence,1980,7.5,['Drama'],"Hungarian, German","Ildik Bnsgi, Pter Andorai, Oszkrn Gombik",Istvn Szab
Girls,1980,5.2,['Drama'],French,"Anne Parillaud, Zo Chauveau, Charlotte Walior",Just Jaeckin
Quello strano desiderio,1980,4.6,"['Comedy', 'SciFi']",Italian,"Nico Salatino, Gianni Ciardo, Vanni Materassi",Enzo Milioni
Challengers,2024,7.1,"['Psychological Drama', 'Steamy Romance', 'Comedy', 'Drama', 'Romance', 'Sport']","English, Romanian","Mike Faist, Josh OConnor, Zendaya",Luca Guadagnino
The Exorcism,2024,4.2,"['Psychological Horror', 'Supernatural Horror', 'Horror', 'Thriller']",English,"Russell Crowe, Ryan Simpkins, Sam Worthington",Joshua John Miller
Bird,2024,7.1,"['ComingofAge', 'Drama']",English,"Nykiya Adams, Franz Rogowski, Barry Keoghan",Andrea Arnold
Crossing,2024,7.5,['Drama'],"Georgian, Turkish, English","Mzia Arabuli, Lucas Kankava, Deniz Dumanli",Levan Akin
The Last Showgirl,2024,6.1,['Drama'],English,"Pamela Anderson, Brenda Song, Kiernan Shipka",Gia Coppola
Rajkumar,2024,7.3,"['Drama', 'Family', 'Romance']",Bengali,"Shakib Khan, Courtney Coffey, Collin Chiucchini",Himel Ashraf
Pastor's Kid,2024,6.5,"['Biography', 'Drama']",English,"Courtney Bandeko, James C Burns, Krista Morin",Benjamin Ironside Koppin
Mind Body & Soul,2024,7.5,['Comedy'],English,"Conr Kinman, Melissa Bergland, Eric Wu",Robert Lang
Jackpot!,2024,5.8,"['Buddy Comedy', 'Dark Comedy', 'Slapstick', 'Action', 'Comedy']",English,"John Cena, Awkwafina, Simu Liu",Paul Feig
Armand,2024,6.4,"['Psychological Drama', 'Drama']","Norwegian, English","Renate Reinsve, Ellen Dorrit Petersen, ystein Rger",Halfdan Ullmann Tndel
Diamanti,2024,7.1,"['Comedy', 'Drama']",Italian,"Luisa Ranieri, Jasmine Trinca, Stefano Accorsi",Ferzan zpetek
Mea Culpa,2024,4.2,"['Erotic Thriller', 'Crime', 'Drama', 'Thriller']",English,"Kelly Rowland, Trevante Rhodes, Nick Sagar",Tyler Perry
All the Lost Ones,2024,4.3,"['Drama', 'SciFi', 'Thriller']",English,"Jasmine Mathews, Vinessa Antoine, Devon Sawa",Mackenzie Donaldson
Brewster's Millions: Christmas,2024,5.7,['Family'],English,"China Anne McClain, Romeo Miller, Rain Pryor",Patricia CuffieJones
Colors of Evil: Red,2024,6.4,"['Crime', 'Drama', 'Mystery', 'Thriller']",Polish,"Jakub Gierszal, Maja Ostaszewska, Zofia Jastrzebska",Adrian Panek
Ricochet,1991,6.2,"['Cop Drama', 'Action', 'Crime', 'Drama', 'Thriller']","English, Spanish, German, French","Denzel Washington, John Lithgow, IceT",Russell Mulcahy
Career Opportunities,1991,5.8,"['FeelGood Romance', 'Romantic Comedy', 'Comedy', 'Romance']",English,"Frank Whaley, Jennifer Connelly, Dermot Mulroney",Bryan Gordon
Dice Rules,1991,5.3,"['StandUp', 'Comedy', 'Documentary']",English,"Andrew Dice Clay, Eddie Griffin, Sylvia Harman",Jay Dubin
Danzón,1991,6.8,['Drama'],Spanish,"Mara Rojo, Carmen Salinas, Tito Vasconcelos",Mara Novaro
A Scene at the Sea,1991,7.5,"['Comedy', 'Drama', 'Romance', 'Sport']",Japanese,"Claude Maki, Hiroko shima, Sabu Kawahara",Takeshi Kitano
Grand Tour: Disaster in Time,1991,6.4,"['Dark Comedy', 'Mystery', 'SciFi']",English,"Jeff Daniels, Ariana Richards, Emilia Crow",David Twohy
Den ofrivillige golfaren,1991,5.7,"['Comedy', 'Sport']","Swedish, Norwegian, English","Lasse berg, Jon Skolmen, Mats Bergman",Lasse berg
The Hideaway,1991,6.6,['Drama'],Danish,"Kasper Tuxen, Allan Winther, Ditte Grbl",Niels Grbl
Major League,1989,7.2,"['Baseball', 'Comedy', 'Sport']","English, Spanish, Japanese","Tom Berenger, Charlie Sheen, Corbin Bernsen",David S Ward
"Sex, Lies, and Videotape",1989,7.2,"['Dark Comedy', 'Drama']",English,"James Spader, Andie MacDowell, Peter Gallagher",Steven Soderbergh
Communion,1989,5.5,"['Biography', 'Drama', 'Horror', 'SciFi', 'Thriller']",English,"Christopher Walken, Lindsay Crouse, Frances Sternhagen",Philippe Mora
Night Game,1989,5.0,"['Crime', 'Drama', 'Horror', 'Mystery', 'Thriller']",English,"Roy Scheider, Karen Young, Lane Smith",Peter Masterson
Animal Behavior,1989,3.9,"['Comedy', 'Romance']",English,"Karen Allen, Armand Assante, Josh Mostel","Jenny Bowen, Kjehl Rasmussen"
Far from Home,1989,5.5,"['Crime', 'Drama', 'Mystery', 'Thriller']",English,"Matt Frewer, Drew Barrymore, Richard Masur",Meiert Avis
Urotsukidoji: Legend of the Overfiend,1989,6.3,"['Adult Animation', 'Anime', 'Dark Comedy', 'Animation', 'Fantasy', 'Horror', 'Romance']",Japanese,"Christopher Courage, Rebel Joy, Sonny Weil",Hideki Takayama
Snake Eater,1989,4.5,['Action'],English,"Lorenzo Lamas, Josie Bell, Robert Scott",George Erschbamer
The Meeting Point,1989,8.2,"['Satire', 'Comedy', 'Drama', 'Fantasy']",SerboCroatian,"Rade Markovic, Bogdan Diklic, Dragan Nikolic",Goran Markovic
Eversmile New Jersey,1989,5.4,"['Comedy', 'Drama', 'Romance']",English,"Daniel DayLewis, Mirjana Jokovic, Gabriela Acher",Carlos Sorin
I Want to Go Home,1989,5.4,"['Satire', 'Comedy']","French, English","Laura Benson, Adolph Green, Linda Lavin",Alain Resnais
Batwara,1989,6.3,"['Action', 'Drama']",Hindi,"Dharmendra, Vinod Khanna, Dimple Kapadia",JP Dutta
Life as We Know It,2010,6.5,"['Romantic Comedy', 'Comedy', 'Drama', 'Romance']",English,"Katherine Heigl, Josh Duhamel, Josh Lucas",Greg Berlanti
The Last Exorcism,2010,5.7,"['Found Footage Horror', 'Supernatural Horror', 'Horror', 'Mystery', 'Thriller']","English, Latin","Patrick Fabian, Ashley Bell, Iris Bahr",Daniel Stamm
Of Gods and Men,2010,7.2,"['Drama', 'History']","French, Arabic","Lambert Wilson, Michael Lonsdale, Olivier Rabourdin",Xavier Beauvois
Housefull,2010,5.6,"['Comedy', 'Drama']",Hindi,"Akshay Kumar, Deepika Padukone, Riteish Deshmukh",Sajid Khan
Love Crime,2010,6.5,"['Psychological Thriller', 'Crime', 'Drama', 'Mystery', 'Thriller']","French, English, Japanese","Ludivine Sagnier, Kristin Scott Thomas, Patrick Mille",Alain Corneau
The Nutcracker: The Untold Story,2010,4.1,"['Action', 'Family', 'Fantasy', 'Musical']",English,"Richard Philipps, Fernanda Dorogi, Kriszta Dorogi",Andrei Konchalovsky
The Big Picture,2010,6.6,"['Drama', 'Thriller']","French, Serbian, English","Romain Duris, Marina Fos, Niels Arestrup",ric Lartigau
Exporting Raymond,2010,6.8,"['Comedy', 'Documentary']","Russian, English","Phil Rosenthal, Peter Boyle, Stanislav Duzhnikov",Phil Rosenthal
The Human Resources Manager,2010,6.6,"['Comedy', 'Drama']","Hebrew, English, Romanian, French","Mark Ivanir, Guri Alfi, Noah Silver",Eran Riklis
